{
  "$schema": "../../../schemas/app.manifest.schema.json",
  "schemaVersion": 2,
  "slug": "safrimba",
  "name": "Safrimba",
  "shortDescription": "On-chain digital tontines via CosmWasm — transparent rotating savings groups.",
  "description": "Safrimba demonstrates CosmWasm usage on Safrochain: rotating savings groups with automated contribution and distribution rules. The official website highlights it in the FAQ and roadmap (beta) as a flagship product for financial inclusion.",
  "url": "https://safrimba.safrochain.com/app/discover",
  "status": "live",
  "chains": [
    "safrochain-testnet",
    "safrochain-mainnet"
  ],
  "category": "defi",
  "tags": [
    "cosmwasm",
    "savings",
    "tontine",
    "featured",
    "testnet"
  ],
  "submittedAt": "2026-04-06",
  "updatedAt": "2026-08-14",
  "version": "0.1.0-beta.1",
  "statusNote": "Live on Safrochain testnet at safrimba.safrochain.com. Mainnet at launch.",
  "links": {
    "website": "https://safrimba.safrochain.com/app/discover",
    "x": "https://twitter.com/safrochain",
    "docs": "https://safrimba.safrochain.com/docs"
  },
  "deployments": {
    "mainnet": {
      "live": false,
      "url": "https://safrimba.safrochain.com/app/discover"
    },
    "testnet": {
      "live": true,
      "url": "https://safrimba.safrochain.com/app/discover"
    }
  }
}
