{
  "$schema": "../../../schemas/app.manifest.schema.json",
  "schemaVersion": 2,
  "slug": "keplr",
  "name": "Keplr Wallet",
  "shortDescription": "Leading Cosmos wallet — supported for Safrochain testnet as listed on the official website.",
  "description": "Keplr is a popular browser extension and mobile app for Cosmos chains. Safrochain lists Keplr as a compatible wallet (testnet live, mainnet coming), making it a gateway for holding and using SAF within the interchain ecosystem.",
  "url": "https://www.keplr.app/",
  "status": "live",
  "chains": [
    "safrochain-mainnet",
    "safrochain-testnet"
  ],
  "category": "wallet",
  "tags": [
    "wallet",
    "cosmos",
    "extension"
  ],
  "submittedAt": "2026-04-06",
  "updatedAt": "2026-08-11",
  "links": {
    "x": "https://twitter.com/keplrwallet",
    "docs": "https://docs.keplr.app"
  },
  "deployments": {
    "mainnet": {
      "live": true,
      "url": "https://www.keplr.app/"
    },
    "testnet": {
      "live": true,
      "url": "https://www.keplr.app/"
    }
  }
}
