{
  "$schema": "../../../schemas/app.manifest.schema.json",
  "schemaVersion": 2,
  "slug": "dyma",
  "name": "Dyma",
  "shortDescription": "Dyma on Safrochain — live on testnet with a dedicated landing experience.",
  "description": "Dyma is available on Safrochain testnet. Open the testnet landing to explore the product while mainnet availability is prepared.",
  "url": "https://testnet.landing.dyma.io",
  "status": "live",
  "statusNote": "Live on Safrochain testnet.",
  "chains": [
    "safrochain-testnet",
    "safrochain-mainnet"
  ],
  "deployments": {
    "testnet": {
      "live": true,
      "url": "https://testnet.landing.dyma.io"
    },
    "mainnet": {
      "live": false
    }
  },
  "category": "defi",
  "tags": [
    "testnet",
    "defi"
  ],
  "links": {
    "website": "https://testnet.landing.dyma.io"
  },
  "submittedAt": "2026-08-11",
  "updatedAt": "2026-08-11"
}
