{
  "$schema": "../../../schemas/app.manifest.schema.json",
  "schemaVersion": 2,
  "slug": "winsaf",
  "name": "WinSaf",
  "shortDescription": "Provably-fair on-chain lottery in Telegram with a non-custodial MPC wallet, CosmWasm draws, and SAF prizes.",
  "description": "WinSaf is a non-custodial, provably-fair lottery delivered as a Telegram Mini App on Safrochain. Users open the bot, set a PIN to create a 2-of-3 MPC wallet, fund it with SAF, and buy tickets in one tap with no seed phrase or browser extension required.\n\nDraws run on-chain via an open-source CosmWasm contract with verifiable randomness from the public drand beacon. Prize tiers, jackpot rollovers, and a Must Be Won rule are enforced in contract logic. Players can verify every round on the Safrochain explorer.\n\nThe product includes referral rewards, daily missions, achievements, responsible-play limits, and English/French UI. CosmWasm contracts are Apache-2.0 on GitHub; ticket sales and prize claims settle in SAF.",
  "url": "https://winsaf.xyz/",
  "version": "1.0.0",
  "launchDate": "2026-07-02",
  "status": "live",
  "statusNote": "Live on Safrochain mainnet and testnet via Telegram Mini App.",
  "chains": [
    "safrochain-mainnet",
    "safrochain-testnet"
  ],
  "category": "gaming",
  "tags": [
    "lottery",
    "telegram",
    "mini-app",
    "cosmwasm",
    "mpc",
    "provably-fair",
    "non-custodial",
    "saf",
    "featured"
  ],
  "links": {
    "website": "https://winsaf.xyz/",
    "docs": "https://github.com/Dev-Community-IO/winsaf-contracts",
    "github": "https://github.com/Dev-Community-IO/winsaf-contracts",
    "telegram": "https://t.me/WinSafBot",
    "x": "https://twitter.com/safrochain"
  },
  "team": {
    "name": "Dev-Community-IO",
    "email": "hello@winsaf.xyz"
  },
  "isOpenSource": true,
  "license": "Apache-2.0",
  "languages": ["en", "fr"],
  "submittedAt": "2026-07-06",
  "updatedAt": "2026-08-11",
  "deployments": {
    "mainnet": {
      "live": true,
      "url": "https://winsaf.xyz/"
    },
    "testnet": {
      "live": true,
      "url": "https://winsaf.xyz/"
    }
  }
}
