{
  "$schema": "../../../schemas/app.manifest.schema.json",
  "schemaVersion": 2,
  "slug": "grantprogram",
  "name": "Grant Program",
  "shortDescription": "Funding for ecosystem builders and projects — announced as coming soon on the official site.",
  "description": "The grant program aims to support teams building dApps, infrastructure, and tooling around SAF and Safrochain. It complements the technical roadmap (mainnet, foundation, partnerships).",
  "url": "https://www.safrochain.com/",
  "status": "beta",
  "chains": [
    "safrochain-mainnet"
  ],
  "category": "dao",
  "tags": [
    "grants",
    "builders",
    "ecosystem"
  ],
  "submittedAt": "2026-04-06",
  "updatedAt": "2026-08-11",
  "statusNote": "Announced as coming soon; not live yet.",
  "links": {
    "x": "https://twitter.com/safrochain"
  },
  "deployments": {
    "mainnet": {
      "live": false,
      "url": "https://www.safrochain.com/"
    }
  }
}
