{
  "$schema": "../../../schemas/app.manifest.schema.json",
  "schemaVersion": 2,
  "slug": "safrohub",
  "name": "Safrochain Hub Mobile App",
  "shortDescription": "Official Safrochain mobile wallet — swap, bridge, stake, and manage SAF on iOS and Android.",
  "description": "Safrochain Hub Mobile App is the official mobile wallet for the Safrochain ecosystem. Send and receive SAF, swap SAF/USDC, bridge assets across Safrochain, Osmosis, and Noble, stake with validators, and explore ecosystem dApps — all from your phone with WalletConnect signing.",
  "url": "https://hub.safrochain.com/",
  "status": "live",
  "chains": ["safrochain-testnet"],
  "category": "infrastructure",
  "tags": ["hub", "ecosystem", "saf"],
  "submittedAt": "2026-04-06",
  "updatedAt": "2026-06-27",
  "launchDate": "2025-01-01",
  "links": {
    "x": "https://twitter.com/safrochain",
    "docs": "https://docs.safrochain.com"
  }
}
