{
  "$schema": "../../../schemas/app.manifest.schema.json",
  "schemaVersion": 2,
  "slug": "leadr",
  "name": "LEADR",
  "shortDescription": "World-leader NFTs on Safrochain — wax-print likeness plus socio-economic Mandate weights. Soon on mainnet.",
  "description": "LEADR is a Safrochain mainnet NFT collection of world leaders. Each piece pairs a stylized Likeness (African wax-print frame, geometric avatar, visible skin-tone and signature costume motifs) with Mandate weights — historical socio-economic axes such as state capacity, redistribution, openness, personalism, and militarization — so figures who share a silhouette (for example military dress) stay distinct in metadata and gameplay.\n\nDesign overview: users will mint or generate leaders when public sources can verify identity; art stays abstract (Ankara textile language, not photoreal). Confusable peers are separated by signature motifs and anti-traits (e.g. white tunic vs olive fatigue vs leopard cloth) plus divergent Mandate scores.\n\nEcosystem links (planned): LEADR is meant to sit beside geographically linked Safrochain assets and apps — regional stablecoins and IBC USDC corridors, localized Hub / Ekival / Safrimba experiences by city and language, and validator or WADA-style partnerships where Mandate traits can gate quests, allowlists, or regional campaigns. Mint and marketplace settlement target SAF (and optional stable pairs) on mainnet.\n\nStatus: Soon on Safrochain mainnet. Not live yet.",
  "url": "https://hub.safrochain.com/",
  "version": "0.1.0",
  "status": "development",
  "statusNote": "Soon — Safrochain mainnet listing only. Collection and mint UX not live yet.",
  "chains": [
    "safrochain-mainnet"
  ],
  "category": "nft",
  "tags": [
    "nft",
    "soon",
    "mainnet",
    "leaders",
    "cosmwasm",
    "culture",
    "featured"
  ],
  "links": {
    "website": "https://hub.safrochain.com/",
    "docs": "https://docs.safrochain.com"
  },
  "languages": [
    "en",
    "fr"
  ],
  "submittedAt": "2026-09-04",
  "updatedAt": "2026-09-04"
}
