{
  "$schema": "../../../schemas/app.manifest.schema.json",
  "schemaVersion": 2,
  "slug": "safhandle",
  "name": "Safhandle",
  "shortDescription": "Short names and phone numbers resolve to Safrochain wallet addresses. The human-readable identity layer.",
  "description": "Safhandle is the human-readable identity layer for Safrochain. Resolve short names and phone links like `john` or `+243899123456` to `addr_safro` addresses instead of pasting long bech32 strings.\n\nBuilt on CosmWasm registry contracts with shared validation for wallets and dApps. Live on mainnet and testnet at handle.safrochain.com.",
  "url": "https://handle.safrochain.com",
  "status": "live",
  "statusNote": "Live on Safrochain mainnet and testnet.",
  "chains": [
    "safrochain-mainnet",
    "safrochain-testnet"
  ],
  "category": "tooling",
  "tags": [
    "identity",
    "handles",
    "sdk",
    "cosmwasm",
    "phone",
    "featured"
  ],
  "links": {
    "website": "https://handle.safrochain.com",
    "github": "https://github.com/Safrochain-Org/safhandle-sdk",
    "docs": "https://github.com/Safrochain-Org/safhandle-sdk/blob/main/docs/README.md"
  },
  "isOpenSource": true,
  "license": "MIT",
  "submittedAt": "2026-06-27",
  "updatedAt": "2026-08-11",
  "deployments": {
    "mainnet": {
      "live": true,
      "url": "https://handle.safrochain.com"
    },
    "testnet": {
      "live": true,
      "url": "https://handle.safrochain.com"
    }
  }
}
